### ISSUE TITLE
Networking Issue on System Reboot

### ISSUE THREAD

**Issue by mattdombrowski21** [containers/podman.io_old#123]
I seem to have found an interesting bug dealing with how the container networking is setup on system reboots. The container I am trying to run is created and launched by systemd and is enabled on restart. 
Here is the service file for my container:
```
[Unit]
Description = Squid Proxy Container Service
Wants       = network.target

[Service]
Restart = always
Type = simple
RemainAfterExit = yes
ExecStart = /usr/bin/podman run -dt -v /etc/squid/squid.conf:/etc/squid/squid.conf:Z -p 3128:3128 --name squid-cont squid-img
ExecStop = /usr/bin/podman stop -t 2 squid-cont
ExecStop = /usr/bin/podman rm squid-cont

[Install]
WantedBy = multi-user.target
```

Right off the bat, there is no way to reach the container externally on port 3128. Sending a ping to 1.1.1.1 from within the container results in the following when doing a tcpdump (note that this is listening on all interfaces):
```
[Interface:veth10d87c76:]    10:02:56.349301 IP 10.88.1.201 > 1.1.1.1: ICMP echo request, id 54, seq 1, length 64
[Interface:cni0:]    10:02:56.349301 IP 10.88.1.201 > 1.1.1.1: ICMP echo request, id 54, seq 1, length 64
[Interface:ens192:]    10:02:57.373370 IP 10.88.1.201 > 1.1.1.1: ICMP echo request, id 54, seq 1, length 64
```

The ip address of my container is 10.88.1.201 and the host machine's ip is 10.11.4.34. As you can see, there must be some sort of NAT issue between the cni0 interface and the ens192 interface where the ip is not translated over. 

The expected output from tcpdump if things were working properly would be like this:
```
[Interface:veth10d87c76:]    10:02:56.349301 IP 10.88.1.201 > 1.1.1.1: ICMP echo request, id 54, seq 1, length 64
[Interface:cni0:]    10:02:56.349301 IP 10.88.1.201 > 1.1.1.1: ICMP echo request, id 54, seq 1, length 64
[Interface:ens192:]    10:02:57.373370 IP 10.11.4.34 > 1.1.1.1: ICMP echo request, id 54, seq 1, length 64
```

To further complicate things, restarting the service will resolve the problem and the ip translation between the interfaces works as expected. Additionally, bringing up another container manually will resolve the issue. The only time I am seeing this problem is when the container is launched as a service on startup after rebooting the system.

**Comment by mattdombrowski21** [comment]
I realized this was not the right place to open this issue.
